[AS-IS] L3,[AS-IS] L4,[AS-IS] L5,[AS-IS] L6,[TO-BE] L3,[TO-BE] L4,[TO-BE] L5,[TO-BE] L6,추천 주체,전략 사유
교육,교육운영,대상자 모집/선발,대상자 모집 공지,교육,교육운영,대상자 모집/선발,대상자 모집 공지 시스템 발송,Digital Worker,일괄 메일/메시지 발송 작업
교육,교육운영,대상자 모집/선발,대상자 선발,교육,교육운영,대상자 모집/선발,대상자 선발 검토 완료,Digital Worker,기본 요건에 대한 1차 시스템/RPA 검토
교육,교육운영,대상자 모집/선발,대상자 선발,교육,교육운영,대상자 모집/선발,대상자 선발 결과 확정,HR,결과물에 대한 최종 책임 및 의사결정
교육,교육운영,대상자 모집/선발,대상자 선발 확정안내,교육,교육운영,대상자 모집/선발,대상자 선발 확정안내 문구 확정,HR,안내/공지할 내용의 초안 컨펌
교육,교육운영,대상자 모집/선발,대상자 선발 확정안내,교육,교육운영,대상자 모집/선발,대상자 선발 확정안내 시스템 발송,Digital Worker,일괄 메일/메시지 발송 작업
교육,교육운영,입과안내/교육생 관리,교육생 명단 관리,교육,교육운영,입과안내/교육생 관리,교육생 명단 관리 요청 접수 완료,Digital Worker,시스템상 요청 내역 접수
교육,교육운영,입과안내/교육생 관리,교육생 명단 관리,교육,교육운영,입과안내/교육생 관리,교육생 명단 관리 현장 조치 완료,SSC,물리적/육안 작업이 필요한 행정 지원 패키지 이관
교육,교육운영,입과안내/교육생 관리,교육 입과안내,교육,교육운영,입과안내/교육생 관리,교육 입과안내 문구 확정,HR,안내/공지할 내용의 초안 컨펌
교육,교육운영,입과안내/교육생 관리,교육 입과안내,교육,교육운영,입과안내/교육생 관리,교육 입과안내 시스템 발송,Digital Worker,일괄 메일/메시지 발송 작업
교육,교육운영,입과안내/교육생 관리,교육생 분석,교육,교육운영,입과안내/교육생 관리,교육생 분석 검토 완료,Digital Worker,기본 요건에 대한 1차 시스템/RPA 검토
교육,교육운영,입과안내/교육생 관리,교육생 분석,교육,교육운영,입과안내/교육생 관리,교육생 분석 결과 확정,HR,결과물에 대한 최종 책임 및 의사결정
교육,교육운영,입과안내/교육생 관리,VOC 대응,교육,교육운영,입과안내/교육생 관리,VOC 대응 검토 완료,Digital Worker,기본 요건에 대한 1차 시스템/RPA 검토
교육,교육운영,입과안내/교육생 관리,VOC 대응,교육,교육운영,입과안내/교육생 관리,VOC 대응 결과 확정,HR,결과물에 대한 최종 책임 및 의사결정
교육,교육운영,내/외부 강사관리,배차 신청,교육,교육운영,내/외부 강사관리,배차 신청 검토 완료,Digital Worker,기본 요건에 대한 1차 시스템/RPA 검토
교육,교육운영,내/외부 강사관리,배차 신청,교육,교육운영,내/외부 강사관리,배차 신청 결과 확정,HR,결과물에 대한 최종 책임 및 의사결정
교육,교육운영,내/외부 강사관리,방문 신청,교육,교육운영,내/외부 강사관리,방문 신청 검토 완료,Digital Worker,기본 요건에 대한 1차 시스템/RPA 검토
교육,교육운영,내/외부 강사관리,방문 신청,교육,교육운영,내/외부 강사관리,방문 신청 결과 확정,HR,결과물에 대한 최종 책임 및 의사결정
교육,교육운영,내/외부 강사관리,식권 신청,교육,교육운영,내/외부 강사관리,식권 신청 검토 완료,Digital Worker,기본 요건에 대한 1차 시스템/RPA 검토
교육,교육운영,내/외부 강사관리,식권 신청,교육,교육운영,내/외부 강사관리,식권 신청 결과 확정,HR,결과물에 대한 최종 책임 및 의사결정
교육,교육운영,내/외부 강사관리,벤더 등록,교육,교육운영,내/외부 강사관리,벤더 등록 ERP 시스템 등록,Digital Worker,결정된 데이터를 시스템에 기계적 반영
교육,교육운영,내/외부 강사관리,교육과정/강의 안내,교육,교육운영,내/외부 강사관리,교육과정/강의 안내 문구 확정,HR,안내/공지할 내용의 초안 컨펌
교육,교육운영,내/외부 강사관리,교육과정/강의 안내,교육,교육운영,내/외부 강사관리,교육과정/강의 안내 시스템 발송,Digital Worker,일괄 메일/메시지 발송 작업
교육,교육운영,내/외부 강사관리,강사 영접 및 VOC 대응,교육,교육운영,내/외부 강사관리,강사 영접 및 VOC 대응 검토 완료,Digital Worker,기본 요건에 대한 1차 시스템/RPA 검토
교육,교육운영,내/외부 강사관리,강사 영접 및 VOC 대응,교육,교육운영,내/외부 강사관리,강사 영접 및 VOC 대응 결과 확정,HR,결과물에 대한 최종 책임 및 의사결정
교육,교육운영,운영준비(인프라 셋팅 등),운영관련 체크리스트 준비,교육,교육운영,운영준비(인프라 셋팅 등),운영관련 체크리스트 준비 검토 완료,Digital Worker,기본 요건에 대한 1차 시스템/RPA 검토
교육,교육운영,운영준비(인프라 셋팅 등),운영관련 체크리스트 준비,교육,교육운영,운영준비(인프라 셋팅 등),운영관련 체크리스트 준비 결과 확정,HR,결과물에 대한 최종 책임 및 의사결정
교육,교육운영,운영준비(인프라 셋팅 등),시설 예약,교육,교육운영,운영준비(인프라 셋팅 등),시설 예약 검토 완료,Digital Worker,기본 요건에 대한 1차 시스템/RPA 검토
교육,교육운영,운영준비(인프라 셋팅 등),시설 예약,교육,교육운영,운영준비(인프라 셋팅 등),시설 예약 결과 확정,HR,결과물에 대한 최종 책임 및 의사결정
교육,교육운영,운영준비(인프라 셋팅 등),PC 대여/반납 준비,교육,교육운영,운영준비(인프라 셋팅 등),PC 대여/반납 준비 검토 완료,Digital Worker,기본 요건에 대한 1차 시스템/RPA 검토
교육,교육운영,운영준비(인프라 셋팅 등),PC 대여/반납 준비,교육,교육운영,운영준비(인프라 셋팅 등),PC 대여/반납 준비 결과 확정,HR,결과물에 대한 최종 책임 및 의사결정
교육,교육운영,운영준비(인프라 셋팅 등),교보재 준비,교육,교육운영,운영준비(인프라 셋팅 등),교보재 준비 검토 완료,Digital Worker,기본 요건에 대한 1차 시스템/RPA 검토
교육,교육운영,운영준비(인프라 셋팅 등),교보재 준비,교육,교육운영,운영준비(인프라 셋팅 등),교보재 준비 결과 확정,HR,결과물에 대한 최종 책임 및 의사결정
교육,교육운영,운영준비(인프라 셋팅 등),다과 준비,교육,교육운영,운영준비(인프라 셋팅 등),다과 준비 검토 완료,Digital Worker,기본 요건에 대한 1차 시스템/RPA 검토
교육,교육운영,운영준비(인프라 셋팅 등),다과 준비,교육,교육운영,운영준비(인프라 셋팅 등),다과 준비 결과 확정,HR,결과물에 대한 최종 책임 및 의사결정
교육,교육운영,운영준비(인프라 셋팅 등),강의장 세팅,교육,교육운영,운영준비(인프라 셋팅 등),강의장 세팅 검토 완료,Digital Worker,기본 요건에 대한 1차 시스템/RPA 검토
교육,교육운영,운영준비(인프라 셋팅 등),강의장 세팅,교육,교육운영,운영준비(인프라 셋팅 등),강의장 세팅 결과 확정,HR,결과물에 대한 최종 책임 및 의사결정
교육,교육운영,운영준비(인프라 셋팅 등),파우치/퀵/택배/DHL 발송,교육,교육운영,운영준비(인프라 셋팅 등),파우치/퀵/택배/DHL 발송 검토 완료,Digital Worker,기본 요건에 대한 1차 시스템/RPA 검토
교육,교육운영,운영준비(인프라 셋팅 등),파우치/퀵/택배/DHL 발송,교육,교육운영,운영준비(인프라 셋팅 등),파우치/퀵/택배/DHL 발송 결과 확정,HR,결과물에 대한 최종 책임 및 의사결정
교육,교육운영,과정 운영,강의장 점검,교육,교육운영,과정 운영,강의장 점검 검토 완료,Digital Worker,기본 요건에 대한 1차 시스템/RPA 검토
교육,교육운영,과정 운영,강의장 점검,교육,교육운영,과정 운영,강의장 점검 결과 확정,HR,결과물에 대한 최종 책임 및 의사결정
교육,교육운영,과정 운영,강사 영접,교육,교육운영,과정 운영,강사 영접 검토 완료,Digital Worker,기본 요건에 대한 1차 시스템/RPA 검토
교육,교육운영,과정 운영,강사 영접,교육,교육운영,과정 운영,강사 영접 결과 확정,HR,결과물에 대한 최종 책임 및 의사결정
교육,교육운영,과정 운영,출석체크/오리엔테이션,교육,교육운영,과정 운영,출석체크/오리엔테이션 검토 완료,Digital Worker,기본 요건에 대한 1차 시스템/RPA 검토
교육,교육운영,과정 운영,출석체크/오리엔테이션,교육,교육운영,과정 운영,출석체크/오리엔테이션 결과 확정,HR,결과물에 대한 최종 책임 및 의사결정
교육,교육운영,과정 운영,강의 및 퍼실리테이팅/코칭 진행,교육,교육운영,과정 운영,강의 및 퍼실리테이팅/코칭 진행 검토 완료,Digital Worker,기본 요건에 대한 1차 시스템/RPA 검토
교육,교육운영,과정 운영,강의 및 퍼실리테이팅/코칭 진행,교육,교육운영,과정 운영,강의 및 퍼실리테이팅/코칭 진행 결과 확정,HR,결과물에 대한 최종 책임 및 의사결정
교육,교육운영,과정 운영,강의내용 통역(필요시),교육,교육운영,과정 운영,강의내용 통역(필요시) 검토 완료,Digital Worker,기본 요건에 대한 1차 시스템/RPA 검토
교육,교육운영,과정 운영,강의내용 통역(필요시),교육,교육운영,과정 운영,강의내용 통역(필요시) 결과 확정,HR,결과물에 대한 최종 책임 및 의사결정
교육,교육운영,과정 운영,강의내용(질의응답) 정리/요약,교육,교육운영,과정 운영,강의내용(질의응답) 정리/요약 검토 완료,Digital Worker,기본 요건에 대한 1차 시스템/RPA 검토
교육,교육운영,과정 운영,강의내용(질의응답) 정리/요약,교육,교육운영,과정 운영,강의내용(질의응답) 정리/요약 결과 확정,HR,결과물에 대한 최종 책임 및 의사결정
교육,교육운영,과정설문 취합/분석,과정 설문 준비,교육,교육운영,과정설문 취합/분석,과정 설문 준비 검토 완료,Digital Worker,기본 요건에 대한 1차 시스템/RPA 검토
교육,교육운영,과정설문 취합/분석,과정 설문 준비,교육,교육운영,과정설문 취합/분석,과정 설문 준비 결과 확정,HR,결과물에 대한 최종 책임 및 의사결정
교육,교육운영,과정설문 취합/분석,과정설문 개설,교육,교육운영,과정설문 취합/분석,과정설문 개설 검토 완료,Digital Worker,기본 요건에 대한 1차 시스템/RPA 검토
교육,교육운영,과정설문 취합/분석,과정설문 개설,교육,교육운영,과정설문 취합/분석,과정설문 개설 결과 확정,HR,결과물에 대한 최종 책임 및 의사결정
교육,교육운영,과정설문 취합/분석,과정설문 진행,교육,교육운영,과정설문 취합/분석,과정설문 진행 검토 완료,Digital Worker,기본 요건에 대한 1차 시스템/RPA 검토
교육,교육운영,과정설문 취합/분석,과정설문 진행,교육,교육운영,과정설문 취합/분석,과정설문 진행 결과 확정,HR,결과물에 대한 최종 책임 및 의사결정
교육,교육운영,과정설문 취합/분석,과정설문 분석,교육,교육운영,과정설문 취합/분석,과정설문 분석 검토 완료,Digital Worker,기본 요건에 대한 1차 시스템/RPA 검토
교육,교육운영,과정설문 취합/분석,과정설문 분석,교육,교육운영,과정설문 취합/분석,과정설문 분석 결과 확정,HR,결과물에 대한 최종 책임 및 의사결정
교육,교육운영,성과분석/결과보고,성과 분석,교육,교육운영,성과분석/결과보고,성과 분석 검토 완료,Digital Worker,기본 요건에 대한 1차 시스템/RPA 검토
교육,교육운영,성과분석/결과보고,성과 분석,교육,교육운영,성과분석/결과보고,성과 분석 결과 확정,HR,결과물에 대한 최종 책임 및 의사결정
교육,교육운영,성과분석/결과보고,결과 보고,교육,교육운영,성과분석/결과보고,결과 보고 검토 완료,Digital Worker,기본 요건에 대한 1차 시스템/RPA 검토
교육,교육운영,성과분석/결과보고,결과 보고,교육,교육운영,성과분석/결과보고,결과 보고 결과 확정,HR,결과물에 대한 최종 책임 및 의사결정
교육,교육운영,성과분석/결과보고,우수 교육생 시상,교육,교육운영,성과분석/결과보고,우수 교육생 시상 검토 완료,Digital Worker,기본 요건에 대한 1차 시스템/RPA 검토
교육,교육운영,성과분석/결과보고,우수 교육생 시상,교육,교육운영,성과분석/결과보고,우수 교육생 시상 결과 확정,HR,결과물에 대한 최종 책임 및 의사결정
교육,교육운영,성과분석/결과보고,강사 감사레터 작성/발송(필요시),교육,교육운영,성과분석/결과보고,강사 감사레터 작성/발송(필요시) 데이터 취합 완료,Digital Worker,작성에 필요한 원천 데이터 수집
교육,교육운영,성과분석/결과보고,강사 감사레터 작성/발송(필요시),교육,교육운영,성과분석/결과보고,강사 감사레터 작성/발송(필요시) 기안서 확정,HR,내용 검토 및 기안 확정
교육,교육운영,성과분석/결과보고,교육관련 사진/영상자료 정리,교육,교육운영,성과분석/결과보고,교육관련 사진/영상자료 정리 검토 완료,Digital Worker,기본 요건에 대한 1차 시스템/RPA 검토
교육,교육운영,성과분석/결과보고,교육관련 사진/영상자료 정리,교육,교육운영,성과분석/결과보고,교육관련 사진/영상자료 정리 결과 확정,HR,결과물에 대한 최종 책임 및 의사결정
교육,교육운영,수료 관리 및 경비처리,수료 관리,교육,교육운영,수료 관리 및 경비처리,수료 관리 요청 접수 완료,Digital Worker,시스템상 요청 내역 접수
교육,교육운영,수료 관리 및 경비처리,수료 관리,교육,교육운영,수료 관리 및 경비처리,수료 관리 현장 조치 완료,SSC,물리적/육안 작업이 필요한 행정 지원 패키지 이관
교육,교육운영,수료 관리 및 경비처리,정산 진행,교육,교육운영,수료 관리 및 경비처리,정산 진행 검토 완료,Digital Worker,기본 요건에 대한 1차 시스템/RPA 검토
교육,교육운영,수료 관리 및 경비처리,정산 진행,교육,교육운영,수료 관리 및 경비처리,정산 진행 결과 확정,HR,결과물에 대한 최종 책임 및 의사결정
교육,내부 컨텐츠 개발,강의안 및 교보재 개발,과정개발 계획수립,교육,내부 컨텐츠 개발,강의안 및 교보재 개발,과정개발 계획수립 자료 수집 완료,Digital Worker,과거 이력 및 관련 데이터 수집
교육,내부 컨텐츠 개발,강의안 및 교보재 개발,과정개발 계획수립,교육,내부 컨텐츠 개발,강의안 및 교보재 개발,과정개발 계획수립 최종안 확정,HR,기획안 최종 의사결정
교육,내부 컨텐츠 개발,강의안 및 교보재 개발,강의안 디자인 템플릿 의뢰,교육,내부 컨텐츠 개발,강의안 및 교보재 개발,강의안 디자인 템플릿 의뢰 검토 완료,Digital Worker,기본 요건에 대한 1차 시스템/RPA 검토
교육,내부 컨텐츠 개발,강의안 및 교보재 개발,강의안 디자인 템플릿 의뢰,교육,내부 컨텐츠 개발,강의안 및 교보재 개발,강의안 디자인 템플릿 의뢰 결과 확정,HR,결과물에 대한 최종 책임 및 의사결정
교육,내부 컨텐츠 개발,강의안 및 교보재 개발,모듈계획서 작성,교육,내부 컨텐츠 개발,강의안 및 교보재 개발,모듈계획서 작성 데이터 취합 완료,Digital Worker,작성에 필요한 원천 데이터 수집
교육,내부 컨텐츠 개발,강의안 및 교보재 개발,모듈계획서 작성,교육,내부 컨텐츠 개발,강의안 및 교보재 개발,모듈계획서 작성 기안서 확정,HR,내용 검토 및 기안 확정
교육,내부 컨텐츠 개발,강의안 및 교보재 개발,강의교안 개발,교육,내부 컨텐츠 개발,강의안 및 교보재 개발,강의교안 개발 검토 완료,Digital Worker,기본 요건에 대한 1차 시스템/RPA 검토
교육,내부 컨텐츠 개발,강의안 및 교보재 개발,강의교안 개발,교육,내부 컨텐츠 개발,강의안 및 교보재 개발,강의교안 개발 결과 확정,HR,결과물에 대한 최종 책임 및 의사결정
교육,내부 컨텐츠 개발,강의안 및 교보재 개발,교보재 개발,교육,내부 컨텐츠 개발,강의안 및 교보재 개발,교보재 개발 검토 완료,Digital Worker,기본 요건에 대한 1차 시스템/RPA 검토
교육,내부 컨텐츠 개발,강의안 및 교보재 개발,교보재 개발,교육,내부 컨텐츠 개발,강의안 및 교보재 개발,교보재 개발 결과 확정,HR,결과물에 대한 최종 책임 및 의사결정
교육,내부 컨텐츠 개발,강의안 및 교보재 개발,강의자료 번역(필요시),교육,내부 컨텐츠 개발,강의안 및 교보재 개발,강의자료 번역(필요시) 검토 완료,Digital Worker,기본 요건에 대한 1차 시스템/RPA 검토
교육,내부 컨텐츠 개발,강의안 및 교보재 개발,강의자료 번역(필요시),교육,내부 컨텐츠 개발,강의안 및 교보재 개발,강의자료 번역(필요시) 결과 확정,HR,결과물에 대한 최종 책임 및 의사결정
교육,교육전략,전사 교육 전략 기획,신설/폐강 과정 관리,교육,교육전략,전사 교육 전략 기획,신설/폐강 과정 관리 요청 접수 완료,Digital Worker,시스템상 요청 내역 접수
교육,교육전략,전사 교육 전략 기획,신설/폐강 과정 관리,교육,교육전략,전사 교육 전략 기획,신설/폐강 과정 관리 현장 조치 완료,SSC,물리적/육안 작업이 필요한 행정 지원 패키지 이관
교육,교육니즈분석,요구사항분석,경영진요구사항 분석,교육,교육니즈분석,요구사항분석,경영진요구사항 분석 검토 완료,Digital Worker,기본 요건에 대한 1차 시스템/RPA 검토
교육,교육니즈분석,요구사항분석,경영진요구사항 분석,교육,교육니즈분석,요구사항분석,경영진요구사항 분석 결과 확정,HR,결과물에 대한 최종 책임 및 의사결정
교육,교육니즈분석,요구사항분석,임직원 요구사항 분석,교육,교육니즈분석,요구사항분석,임직원 요구사항 분석 검토 완료,Digital Worker,기본 요건에 대한 1차 시스템/RPA 검토
교육,교육니즈분석,요구사항분석,임직원 요구사항 분석,교육,교육니즈분석,요구사항분석,임직원 요구사항 분석 결과 확정,HR,결과물에 대한 최종 책임 및 의사결정
교육,교육니즈분석,트렌드분석,환경변화 자료검색/리서치,교육,교육니즈분석,트렌드분석,환경변화 자료검색/리서치 검토 완료,Digital Worker,기본 요건에 대한 1차 시스템/RPA 검토
교육,교육니즈분석,트렌드분석,환경변화 자료검색/리서치,교육,교육니즈분석,트렌드분석,환경변화 자료검색/리서치 결과 확정,HR,결과물에 대한 최종 책임 및 의사결정
교육,교육니즈분석,트렌드분석,환경변화 관련 인사이트 발굴,교육,교육니즈분석,트렌드분석,환경변화 관련 인사이트 발굴 검토 완료,Digital Worker,기본 요건에 대한 1차 시스템/RPA 검토
교육,교육니즈분석,트렌드분석,환경변화 관련 인사이트 발굴,교육,교육니즈분석,트렌드분석,환경변화 관련 인사이트 발굴 결과 확정,HR,결과물에 대한 최종 책임 및 의사결정
교육,교육니즈분석,교육대상 분석,임직원 현황 분석(규모/직무/사업부/보직),교육,교육니즈분석,교육대상 분석,임직원 현황 분석(규모/직무/사업부/보직) 검토 완료,Digital Worker,기본 요건에 대한 1차 시스템/RPA 검토
교육,교육니즈분석,교육대상 분석,임직원 현황 분석(규모/직무/사업부/보직),교육,교육니즈분석,교육대상 분석,임직원 현황 분석(규모/직무/사업부/보직) 결과 확정,HR,결과물에 대한 최종 책임 및 의사결정
교육,교육니즈분석,교육대상 분석,특수 국적/언어 등,교육,교육니즈분석,교육대상 분석,특수 국적/언어 등 검토 완료,Digital Worker,기본 요건에 대한 1차 시스템/RPA 검토
교육,교육니즈분석,교육대상 분석,특수 국적/언어 등,교육,교육니즈분석,교육대상 분석,특수 국적/언어 등 결과 확정,HR,결과물에 대한 최종 책임 및 의사결정
교육,교육니즈분석,교육대상 분석,역량 분석(교육이력/자격),교육,교육니즈분석,교육대상 분석,역량 분석(교육이력/자격) 검토 완료,Digital Worker,기본 요건에 대한 1차 시스템/RPA 검토
교육,교육니즈분석,교육대상 분석,역량 분석(교육이력/자격),교육,교육니즈분석,교육대상 분석,역량 분석(교육이력/자격) 결과 확정,HR,결과물에 대한 최종 책임 및 의사결정
교육,교육니즈분석,커리큘럼 기획,전년도 결과 리뷰/분석,교육,교육니즈분석,커리큘럼 기획,전년도 결과 리뷰/분석 검토 완료,Digital Worker,기본 요건에 대한 1차 시스템/RPA 검토
교육,교육니즈분석,커리큘럼 기획,전년도 결과 리뷰/분석,교육,교육니즈분석,커리큘럼 기획,전년도 결과 리뷰/분석 결과 확정,HR,결과물에 대한 최종 책임 및 의사결정
교육,교육니즈분석,커리큘럼 기획,인사이트 발굴,교육,교육니즈분석,커리큘럼 기획,인사이트 발굴 검토 완료,Digital Worker,기본 요건에 대한 1차 시스템/RPA 검토
교육,교육니즈분석,커리큘럼 기획,인사이트 발굴,교육,교육니즈분석,커리큘럼 기획,인사이트 발굴 결과 확정,HR,결과물에 대한 최종 책임 및 의사결정
교육,교육니즈분석,커리큘럼 기획,우선순위 도출,교육,교육니즈분석,커리큘럼 기획,우선순위 도출 검토 완료,Digital Worker,기본 요건에 대한 1차 시스템/RPA 검토
교육,교육니즈분석,커리큘럼 기획,우선순위 도출,교육,교육니즈분석,커리큘럼 기획,우선순위 도출 결과 확정,HR,결과물에 대한 최종 책임 및 의사결정
교육,교육과정설계,커리큘럼 기획,과정목표 수립,교육,교육과정설계,커리큘럼 기획,과정목표 수립 자료 수집 완료,Digital Worker,과거 이력 및 관련 데이터 수집
교육,교육과정설계,커리큘럼 기획,과정목표 수립,교육,교육과정설계,커리큘럼 기획,과정목표 수립 최종안 확정,HR,기획안 최종 의사결정
교육,교육과정설계,커리큘럼 기획,예산 검토,교육,교육과정설계,커리큘럼 기획,예산 검토 검토 완료,Digital Worker,기본 요건에 대한 1차 시스템/RPA 검토
교육,교육과정설계,커리큘럼 기획,예산 검토,교육,교육과정설계,커리큘럼 기획,예산 검토 결과 확정,HR,결과물에 대한 최종 책임 및 의사결정
교육,교육과정설계,커리큘럼 기획,커리큘럼 개발,교육,교육과정설계,커리큘럼 기획,커리큘럼 개발 검토 완료,Digital Worker,기본 요건에 대한 1차 시스템/RPA 검토
교육,교육과정설계,커리큘럼 기획,커리큘럼 개발,교육,교육과정설계,커리큘럼 기획,커리큘럼 개발 결과 확정,HR,결과물에 대한 최종 책임 및 의사결정
교육,교육과정설계,커리큘럼 확정,내부 보고/품의,교육,교육과정설계,커리큘럼 확정,내부 보고/품의 검토 완료,Digital Worker,기본 요건에 대한 1차 시스템/RPA 검토
교육,교육과정설계,커리큘럼 확정,내부 보고/품의,교육,교육과정설계,커리큘럼 확정,내부 보고/품의 결과 확정,HR,결과물에 대한 최종 책임 및 의사결정
교육,교육과정설계,프로그램 운영방안 결정,교육 형태/기간,교육,교육과정설계,프로그램 운영방안 결정,교육 형태/기간 검토 완료,Digital Worker,기본 요건에 대한 1차 시스템/RPA 검토
교육,교육과정설계,프로그램 운영방안 결정,교육 형태/기간,교육,교육과정설계,프로그램 운영방안 결정,교육 형태/기간 결과 확정,HR,결과물에 대한 최종 책임 및 의사결정
교육,교육과정설계,프로그램 운영방안 결정,신청/선발 방식,교육,교육과정설계,프로그램 운영방안 결정,신청/선발 방식 검토 완료,Digital Worker,기본 요건에 대한 1차 시스템/RPA 검토
교육,교육과정설계,프로그램 운영방안 결정,신청/선발 방식,교육,교육과정설계,프로그램 운영방안 결정,신청/선발 방식 결과 확정,HR,결과물에 대한 최종 책임 및 의사결정
